{"schema_id":"hvsr-analyzer/data-dictionary","schema_version":"1.0.0","export_format":"tables-v1","csv_conventions":{"encoding":"UTF-8 without byte-order mark","delimiter":",","decimal_separator":".","header_rows":1,"comment_lines":"none","line_terminator":"\\n","booleans":"true / false","floats":"shortest round-trip decimal representation (parses to the identical binary64 value)","unavailable":"empty cell; the row's `reason` column states why. Zero is never a placeholder.","times":"UTC ISO 8601 with a trailing Z; offsets in seconds from the first canonical sample"},"tables":{"mean_spectrum":{"title":"Mean H/V spectrum","row":"one selection (method / peak family) at one frequency of the analysis grid","description":"Selected-window geometric-mean H/V with the single nominal 95% pointwise band ('Estimated 95% pointwise CI for the selected-window mean'), exactly as in the analysis JSON `selections[].mean_curve`. The band is selection-conditional and its coverage is not calibrated unless the analysis JSON `calibration.status` says otherwise.","columns":[{"name":"selection_id","type":"string","unit":null,"nullable":false,"description":"Selection identifier, as in the analysis JSON."},{"name":"peak_family_id","type":"string","unit":null,"nullable":true,"description":"Peak family of the selection; empty when there is none."},{"name":"frequency_hz","type":"number","unit":"Hz","nullable":false,"description":"Frequency of the anchored logarithmic analysis grid."},{"name":"hv_geometric_mean","type":"number","unit":"dimensionless (H/V)","nullable":true,"description":"Geometric mean of the selected windows' H/V (ln-amplitude average)."},{"name":"ci95_lower","type":"number","unit":"dimensionless (H/V)","nullable":true,"description":"Lower bound of the Estimated 95% pointwise CI for the selected-window mean."},{"name":"ci95_upper","type":"number","unit":"dimensionless (H/V)","nullable":true,"description":"Upper bound of the Estimated 95% pointwise CI for the selected-window mean."},{"name":"count","type":"integer","unit":"windows","nullable":false,"description":"Selected windows valid at this frequency."},{"name":"log_std","type":"number","unit":"natural-log units of H/V","nullable":true,"description":"Sample standard deviation of ln H/V across the selected windows (dispersion, not the CI)."},{"name":"frequency_valid","type":"boolean","unit":null,"nullable":false,"description":"The analysis grid is valid at this frequency."},{"name":"status","type":"string","unit":null,"nullable":false,"description":"Row status.","enum":["ok","ci_limited","ci_unavailable","mean_unavailable","frequency_invalid"]},{"name":"reason","type":"string","unit":null,"nullable":true,"description":"Why each empty numeric cell in this row is unavailable ('column: reason', separated by ' | '). Empty when every value is present."}]},"window_table_standard":{"title":"Per-window table, Standard method","row":"one candidate window of one Standard selection (every candidate, selected or not)","description":"Candidate windows with basic-QC result and the Standard rule outcome (earliest-first non-overlapping windows; optional FDWRA).","columns":[{"name":"selection_id","type":"string","unit":null,"nullable":false,"description":"Selection identifier, as in the analysis JSON."},{"name":"window_id","type":"string","unit":null,"nullable":false,"description":"Stable candidate window ID derived from the start sample."},{"name":"start_sample","type":"integer","unit":"samples","nullable":false,"description":"Window start, samples from the first canonical sample."},{"name":"start_s","type":"number","unit":"s","nullable":false,"description":"Window start, seconds from the first canonical sample."},{"name":"end_s","type":"number","unit":"s","nullable":false,"description":"Window end (exclusive), seconds from the first canonical sample."},{"name":"start_utc","type":"string","unit":"UTC ISO 8601","nullable":true,"description":"Absolute window start; empty when the recording has no absolute start time."},{"name":"segment_index","type":"integer","unit":null,"nullable":false,"description":"Contiguous recording segment containing the window."},{"name":"qc_passed","type":"boolean","unit":null,"nullable":false,"description":"Basic window quality control passed."},{"name":"qc_reasons","type":"string","unit":null,"nullable":true,"description":"Basic-QC rejection reasons separated by ';' (empty when passed)."},{"name":"outcome","type":"string","unit":null,"nullable":false,"description":"Outcome of the Standard rule.","enum":["selected","qc_rejected","overlap_excluded","fdwra_rejected"]},{"name":"selection_order","type":"integer","unit":null,"nullable":true,"description":"1-based position in the selection (time order)."},{"name":"peak_family_id","type":"string","unit":null,"nullable":true,"description":"Peak family used for the per-window peak; empty when there is none."},{"name":"window_peak_frequency_hz","type":"number","unit":"Hz","nullable":true,"description":"Strict in-family peak of this window's H/V (parabolic refinement)."},{"name":"reason","type":"string","unit":null,"nullable":true,"description":"Why each empty numeric cell in this row is unavailable ('column: reason', separated by ' | '). Empty when every value is present."}]},"window_table_sdof":{"title":"Per-window table, SDOF-selected method","row":"one candidate window of one peak family (every candidate, selected or not)","description":"Peak-aligned SDOF template matching (R2_log on the 129-point ln-q grid), eligibility, ranking, and greedy non-overlapping selection inside each plausible peak family.","columns":[{"name":"selection_id","type":"string","unit":null,"nullable":false,"description":"Selection identifier, as in the analysis JSON."},{"name":"peak_family_id","type":"string","unit":null,"nullable":false,"description":"Peak family in which the window was ranked."},{"name":"window_id","type":"string","unit":null,"nullable":false,"description":"Stable candidate window ID derived from the start sample."},{"name":"start_sample","type":"integer","unit":"samples","nullable":false,"description":"Window start, samples from the first canonical sample."},{"name":"start_s","type":"number","unit":"s","nullable":false,"description":"Window start, seconds from the first canonical sample."},{"name":"end_s","type":"number","unit":"s","nullable":false,"description":"Window end (exclusive), seconds from the first canonical sample."},{"name":"start_utc","type":"string","unit":"UTC ISO 8601","nullable":true,"description":"Absolute window start; empty when the recording has no absolute start time."},{"name":"segment_index","type":"integer","unit":null,"nullable":false,"description":"Contiguous recording segment containing the window."},{"name":"qc_passed","type":"boolean","unit":null,"nullable":false,"description":"Basic window quality control passed."},{"name":"qc_reasons","type":"string","unit":null,"nullable":true,"description":"Basic-QC rejection reasons separated by ';' (empty when passed)."},{"name":"eligibility","type":"string","unit":null,"nullable":false,"description":"Matching eligibility status.","enum":["qc_rejected","eligible","no_meaningful_match","no_peak_in_family_band","incomplete_fit_band","outside_common_band","insufficient_resolution","undefined_r2"]},{"name":"outcome","type":"string","unit":null,"nullable":false,"description":"Selection outcome.","enum":["selected","qc_rejected","not_eligible","overlap_excluded","beyond_requested_n"]},{"name":"window_peak_frequency_hz","type":"number","unit":"Hz","nullable":true,"description":"Bank-independent in-family peak frequency fp of this window."},{"name":"window_peak_amplitude","type":"number","unit":"dimensionless (H/V)","nullable":true,"description":"H/V amplitude Ap at fp."},{"name":"fit_band_lower_hz","type":"number","unit":"Hz","nullable":true,"description":"Template fit band lower edge fp/2."},{"name":"fit_band_upper_hz","type":"number","unit":"Hz","nullable":true,"description":"Template fit band upper edge 2 fp."},{"name":"r2_log","type":"number","unit":"dimensionless","nullable":true,"description":"Best-template R2_log (template resemblance, not a quality probability)."},{"name":"r2_rank","type":"integer","unit":null,"nullable":true,"description":"1-based rank among eligible windows: descending R2_log, then earlier start, then window ID."},{"name":"selection_order","type":"integer","unit":null,"nullable":true,"description":"1-based position in the greedy selection order."},{"name":"template_index","type":"integer","unit":null,"nullable":true,"description":"Best template index in the bank."},{"name":"template_parameters","type":"string","unit":null,"nullable":true,"description":"Best template parameters 'name=value' separated by '; '."},{"name":"flags","type":"string","unit":null,"nullable":true,"description":"Matching flags separated by ';'."},{"name":"reason","type":"string","unit":null,"nullable":true,"description":"Why each empty numeric cell in this row is unavailable ('column: reason', separated by ' | '). Empty when every value is present."}]},"window_spectra":{"title":"Per-window H/V spectra","row":"one candidate window at one valid frequency of the analysis grid","description":"Smoothed H/V of every candidate window (selected or not) at the frequencies where the analysis grid is valid (the full grid and its validity are in the analysis JSON). Regenerated deterministically from the stored recording and the run configuration.","columns":[{"name":"window_id","type":"string","unit":null,"nullable":false,"description":"Stable candidate window ID."},{"name":"start_sample","type":"integer","unit":"samples","nullable":false,"description":"Window start, samples from the first canonical sample."},{"name":"frequency_hz","type":"number","unit":"Hz","nullable":false,"description":"Analysis grid frequency."},{"name":"hv","type":"number","unit":"dimensionless (H/V)","nullable":true,"description":"Window H/V amplitude."},{"name":"reason","type":"string","unit":null,"nul